{
  "$kommentar": [
    "Stammdaten des Referenzdatensatzes (E-P1-05). Das Einspielskript legt sie",
    "ueber die regulaeren Einstellungs-Endpunkte an, damit der gesamte Bestand",
    "aus einem LEEREN Konto reproduzierbar ist.",
    "",
    "NAMEN SIND ERFUNDEN, GEOGRAPHIE IST ECHT (E-P1-02). Die Koordinaten liegen",
    "im Allgaeu und am Alpenrand -- ohne sie waeren Tracks, Hoehenprofile und",
    "Kartendarstellung nicht pruefbar. Standorte, Rettungsmittel, Kliniken,",
    "Bergwacht-Einheiten und Besatzung tragen dagegen frei erfundene Namen; ein",
    "realer Rufname (Christoph ...) kommt nirgends vor.",
    "",
    "DER STANDORT IST DER ANKER (schema.sql, E15): Jedes Rettungsmittel, jede",
    "Zielklinik, jede Vorbelegung und jede Bereitschaft gehoert GENAU EINEM",
    "Standort. Deshalb steht an jedem Eintrag ein 'standort'."
  ],
  "standorte": [
    {
      "name": "Luftrettungsstation Hochkreuth",
      "lat": 47.7255,
      "lon": 10.314,
      "standard": true,
      "$warum": "MIT Koordinaten -- nur dann steht der Abfahrtort 'Standort' zur Auswahl (start_src=base)."
    },
    {
      "name": "Notarztstandort Talwang",
      "lat": 47.559,
      "lon": 10.217,
      "standard": false,
      "$warum": "MIT Koordinaten seit dem Demo-Ausbau (E-DA-09). Es sind EXAKT die, die seine acht Bodendienste vorher als `spur_ausgangspunkt` trugen -- `basis_von()` liest damit denselben Wert, und die Spuren dieser acht Tage bleiben byteweise gleich. Der Eintrag `spur_ausgangspunkt` ist an ihnen deshalb entfallen: Ein Ausgangspunkt neben einem Standort mit Koordinaten waere eine zweite Wahrheit."
    },
    {
      "name": "Bergwachtstation Sonnenau",
      "lat": 47.532,
      "lon": 10.287,
      "standard": false,
      "$warum": "Standort des Bergwachtnotarztes (E-DA-05/E-DA-09). Die Koordinate ist ein Stuetzpunkt aus generator/gelaende.py (780 m) -- damit rechnet das Hoehenmodell dort nicht zwischen zwei weit entfernten Stuetzpunkten und die Hoehenprofile der Bergeinsaetze bleiben plausibel. DRITTER Standort: Er belegt die Matrixzeile 'Diensttag an einem Standort ohne Rollen-Vorlagen' -- Typ Bergwacht hat keine (E-S9-09), und dieser Standort fuehrt deshalb bewusst KEINE Besatzungs-Vorbelegung."
    }
  ],
  "rettungsmittel": [
    {
      "name": "Alpenfalke 1",
      "art": "air",
      "standort": "Luftrettungsstation Hochkreuth",
      "rollen": [
        "p1",
        "p2",
        "hems",
        "fr",
        "other"
      ],
      "faehigkeiten": [
        "winch",
        "bergwacht"
      ],
      "standard": true,
      "typ": "standard",
      "kurz": null
    },
    {
      "name": "Alpenfalke 2",
      "art": "air",
      "standort": "Luftrettungsstation Hochkreuth",
      "rollen": [
        "p1",
        "hems",
        "fr"
      ],
      "faehigkeiten": [],
      "standard": false,
      "$warum": "OHNE Faehigkeiten und mit kleinerem Rollensatz. Prueft zweierlei: dass Winden- und Bergwachtfelder an seinen Diensttagen gar nicht erscheinen (cap_gate), und dass der eingefrorene Rollensatz eines Diensttags wirklich vom Rettungsmittel kommt.",
      "typ": "standard",
      "kurz": null
    },
    {
      "name": "NEF Talwang 76/1",
      "art": "ground",
      "standort": "Notarztstandort Talwang",
      "rollen": [
        "driver",
        "trainee",
        "other"
      ],
      "faehigkeiten": [],
      "standard": false,
      "typ": "standard",
      "kurz": null
    },
    {
      "name": "Bergwacht Hochkreuth",
      "kurz": "BW Hoch",
      "typ": "bergwacht",
      "art": "air",
      "standort": "Luftrettungsstation Hochkreuth",
      "rollen": [
        "p1",
        "hems"
      ],
      "faehigkeiten": [
        "winch",
        "bergwacht"
      ],
      "standard": false,
      "$warum": "TYP bergwacht MIT Standort und MIT Kurznamen. Prueft dreierlei: dass ein Typ ausser 'standard' einen Standort haben DARF, dass die Rollen-Vorlagen dabei verworfen werden (E-S9-09 -- die zwei hier mitgeschickten Rollen duerfen NICHT ankommen), und dass der Kurzname den Kreislauf ueberlebt."
    },
    {
      "name": "Sanitätsdienst Seefest",
      "kurz": null,
      "typ": "veranstaltung",
      "art": "air",
      "standort": "Luftrettungsstation Hochkreuth",
      "ohne_standort": true,
      "rollen": [],
      "faehigkeiten": [
        "winch"
      ],
      "standard": false,
      "$warum": "TYP veranstaltung OHNE Standort, mit ABSICHTLICH falscher Betriebsart 'air' und einer Windenfaehigkeit. Prueft, dass die Pruefschicht die Betriebsart auf 'ground' zwingt (E-S9-09) und die Faehigkeit damit von selbst wegfaellt -- ohne den Datensatz abzulehnen. `standort` nennt die Karte, aus der das Formular abgeschickt wird; `ohne_standort` schlaegt sie."
    },
    {
      "name": "Reserve Talwang",
      "kurz": "Reserve",
      "typ": "sonstiges",
      "art": "ground",
      "standort": "Notarztstandort Talwang",
      "ohne_standort": true,
      "rollen": [],
      "faehigkeiten": [],
      "standard": false,
      "$warum": "TYP sonstiges OHNE Standort und MIT Kurznamen -- der Fall, den die Standortliste unter 'Ohne Standort' fuehrt (E-S9-18)."
    },
    {
      "name": "Bergwachtnotarzt Sonnenau",
      "kurz": "BW-NA",
      "typ": "bergwacht",
      "art": "ground",
      "standort": "Bergwachtstation Sonnenau",
      "rollen": [],
      "faehigkeiten": [
        "winch",
        "bergwacht"
      ],
      "standard": false,
      "$warum": "TYP bergwacht am BODEN, MIT beiden Faehigkeiten -- der Fall, fuer den Web 20.3.0 die Regel geaendert hat (E-DA-06): Ein Bergwachtnotarzt faehrt hin und wird von dort geflogen. Prueft dreierlei: dass die Pruefschicht `winch` und `bergwacht` an einem bodengebundenen Rettungsmittel dieses Typs ANNIMMT (vorher verwarf sie sie still), dass `day_capabilities` sie beim Zuordnen einfriert, und dass das Einsatzformular eines Bodendienstes die Windenkacheln zeigt (`cap_gate`, nicht `kind_gate`). Ohne Rollen -- Typ Bergwacht hat keine Vorlagen."
    },
    {
      "name": "VEF Talwang 76/2",
      "kurz": "VEF",
      "typ": "standard",
      "art": "ground",
      "standort": "Notarztstandort Talwang",
      "rollen": [
        "driver",
        "other"
      ],
      "faehigkeiten": [],
      "standard": false,
      "$warum": "Verlegungsfahrzeug (E-DA-07). Es traegt den bodengebundenen SEKUNDAERTRANSPORT -- den gab es im Bestand bisher nur in der Luft (D02, D03, D07). Typ standard mit Standort, also mit Vorschlagslisten und Rollen-Vorlagen; die zwei Rollen sind der kleinere Satz des NEF Talwang, damit der eingefrorene Rollensatz zweier Rettungsmittel am selben Standort unterscheidbar bleibt."
    },
    {
      "name": "Boxkampf Rainer Maria Rilke",
      "kurz": "Boxkampf",
      "typ": "veranstaltung",
      "art": "ground",
      "standort": "Luftrettungsstation Hochkreuth",
      "ohne_standort": true,
      "rollen": [],
      "faehigkeiten": [],
      "standard": false,
      "$warum": "TYP veranstaltung OHNE Standort, und anders als 'Sanitaetsdienst Seefest' traegt es einen DIENSTTAG (E-DA-08). Der Name ist eine historische Person als Veranstaltungstitel -- E-P1-02 verbietet reale RUFNAMEN und ORTE, nicht jede reale Person; VERBOTENE_NAMEN bleibt unveraendert und pruefen.py laeuft ohne Ausnahme durch. `standort` nennt nur die Karte, aus der das Formular abgeschickt wird; `ohne_standort` schlaegt sie und schickt base_id 0."
    },
    {
      "name": "Konzert von Karl Marx",
      "kurz": "Konzert",
      "typ": "veranstaltung",
      "art": "ground",
      "standort": "Luftrettungsstation Hochkreuth",
      "ohne_standort": true,
      "rollen": [],
      "faehigkeiten": [],
      "standard": false,
      "$warum": "Zweite Veranstaltung (E-DA-08). Sie traegt den Diensttag, an dem ALLE Einsaetze von Hand nachgetragen sind: keine Spur, aber Ort- und Zielkoordinate -- die Karte zeichnet daraus gestrichelte Luftlinien. Zwei Veranstaltungen und nicht eine, weil die beiden Diensttage verschiedene Erfassungsarten belegen."
    }
  ],
  "besatzung": [
    {
      "rolle": "p1",
      "name": "Marion Aschenbrenner",
      "standort": "Luftrettungsstation Hochkreuth"
    },
    {
      "rolle": "p1",
      "name": "Tilman Roithner",
      "standort": "Luftrettungsstation Hochkreuth"
    },
    {
      "rolle": "p1",
      "name": "Servatius Kroll",
      "standort": "Luftrettungsstation Hochkreuth"
    },
    {
      "rolle": "p2",
      "name": "Ingrid Voss-Hartmann",
      "standort": "Luftrettungsstation Hochkreuth"
    },
    {
      "rolle": "p2",
      "name": "Béla Sárközy",
      "standort": "Luftrettungsstation Hochkreuth"
    },
    {
      "rolle": "hems",
      "name": "Kerstin Obermeier",
      "standort": "Luftrettungsstation Hochkreuth"
    },
    {
      "rolle": "hems",
      "name": "Jonas Steinlechner",
      "standort": "Luftrettungsstation Hochkreuth"
    },
    {
      "rolle": "hems",
      "name": "Ruth Amrein",
      "standort": "Luftrettungsstation Hochkreuth"
    },
    {
      "rolle": "fr",
      "name": "Vitus Halbritter",
      "standort": "Luftrettungsstation Hochkreuth"
    },
    {
      "rolle": "fr",
      "name": "Nele Brugger",
      "standort": "Luftrettungsstation Hochkreuth"
    },
    {
      "rolle": "other",
      "name": "Elias Sturm (Hospitant)",
      "standort": "Luftrettungsstation Hochkreuth"
    },
    {
      "rolle": "driver",
      "name": "Gerd Wallner",
      "standort": "Notarztstandort Talwang"
    },
    {
      "rolle": "driver",
      "name": "Selma Ibrahimović",
      "standort": "Notarztstandort Talwang"
    },
    {
      "rolle": "trainee",
      "name": "Ronja Pfeil",
      "standort": "Notarztstandort Talwang"
    },
    {
      "rolle": "other",
      "name": "Dr. Hanna Kestner",
      "standort": "Notarztstandort Talwang"
    }
  ],
  "zielkliniken": [
    {
      "name": "Bergklinik Sonnenau",
      "lat": 47.559,
      "lon": 10.217,
      "standort": "Luftrettungsstation Hochkreuth"